product_name,description,features,benefits,category,content,image_url,product_link
Breeze Pure Halawa Wax,"Made from simple, all-natural ingredients, Arabic Halawa Wax is a safe and effective way to remove unwanted hair without harsh chemicals.","All-natural ingredients, Chemical-free, Easy to use","Gentle on skin, Effective hair removal, Suitable for sensitive areas",Hair Removal,"Breeze Pure Halawa Wax | Made from simple, all-natural ingredients, Arabic Halawa Wax is a safe and effective way to remove unwanted hair without harsh chemicals. | All-natural ingredients, Chemical-free, Easy to use | Gentle on skin, Effective hair removal, Suitable for sensitive areas","https://halawawax.com/cdn/shop/files/breeze-pure-halawa-wax-286511.webp?v=1742499062&width=600","https://halawawax.com/products/halawa-wax"
Halawa Card Wax - 200 gm,"Premium organic sugar wax with a free card applicator for quick and easy hair removal. Ready to use.","Organic sugar wax, Free card applicator, Ready to use","Convenient application, Smooth skin, Time-saving",Hair Removal,"Halawa Card Wax - 200 gm | Premium organic sugar wax with a free card applicator for quick and easy hair removal. Ready to use. | Organic sugar wax, Free card applicator, Ready to use | Convenient application, Smooth skin, Time-saving","https://halawawax.com/cdn/shop/files/halawa-card-wax-200-gm-434658.webp?v=1742503323&width=600","https://halawawax.com/products/halawa-card-wax"
Aloe Vera Pure Gel - 150ml,"Soothing Aloe Vera gel made from pure extracts, ideal for calming the skin post-waxing or sun exposure.","Pure Aloe Vera extract, Non-sticky, Fast absorption","Hydrates skin, Reduces redness, Cooling effect",Skin Care,"Aloe Vera Pure Gel - 150ml | Soothing Aloe Vera gel made from pure extracts, ideal for calming the skin post-waxing or sun exposure. | Pure Aloe Vera extract, Non-sticky, Fast absorption | Hydrates skin, Reduces redness, Cooling effect","https://halawawax.com/cdn/shop/files/aloe-vera-pure-gel-100ml-241206.webp?v=1742499251&width=600","https://halawawax.com/products/aloe-vera-pure-gel"
Silky Smooth Trio,"Comprehensive bundle featuring Breeze Pure Halawa Wax, a wooden spatula, and Feather Feel Wax Strips (50 pcs) for a complete waxing experience.","Complete waxing kit, Includes spatula and wax strips","All-in-one solution, Easy at-home waxing, Cost-effective",Hair Removal,"Silky Smooth Trio | Comprehensive bundle featuring Breeze Pure Halawa Wax, a wooden spatula, and Feather Feel Wax Strips (50 pcs) for a complete waxing experience. | Complete waxing kit, Includes spatula and wax strips | All-in-one solution, Easy at-home waxing, Cost-effective","https://halawawax.com/cdn/shop/files/silky-smooth-trio-863355.webp?v=1742445214&width=600","https://halawawax.com/products/silky-smooth-trio"
Dense - Anti-Hair Fall & Hair Growth Serum,"Enriched with natural ingredients to combat hair fall and promote healthy hair growth.","Natural ingredients, Non-greasy formula, Fast-absorbing","Strengthens hair roots, Promotes growth, Reduces hair fall",Hair Care,"Dense - Anti-Hair Fall & Hair Growth Serum | Enriched with natural ingredients to combat hair fall and promote healthy hair growth. | Natural ingredients, Non-greasy formula, Fast-absorbing | Strengthens hair roots, Promotes growth, Reduces hair fall","https://halawawax.com/cdn/shop/files/dense-anti-hair-fall-hair-growth-serum-911770.webp?v=1736747375&width=600","https://halawawax.com/products/dense"
