product_name,description,features,benefits,category
Breeze Pure Halawa Wax,"Made from simple, all-natural ingredients, Arabic Halawa Wax is a safe and effective way to remove unwanted hair without harsh chemicals.","All-natural ingredients, Chemical-free, Easy to use","Gentle on skin, Effective hair removal, Suitable for sensitive areas",Hair Removal
Halawa Card Wax - 200 gm,Premium organic sugar wax with a free card applicator for quick and easy hair removal. Ready to use.,"Organic sugar wax, Free card applicator, Ready to use","Convenient application, Smooth skin, Time-saving",Hair Removal
Aloe Vera Pure Gel - 150ml,"Soothing Aloe Vera gel made from pure extracts, ideal for calming the skin post-waxing or sun exposure.","Pure Aloe Vera extract, Non-sticky, Fast absorption","Hydrates skin, Reduces redness, Cooling effect",Skin Care
Silky Smooth Trio,"Comprehensive bundle featuring Breeze Pure Halawa Wax, a wooden spatula, and Feather Feel Wax Strips (50 pcs) for a complete waxing experience.","Complete waxing kit, Includes spatula and wax strips","All-in-one solution, Easy at-home waxing, Cost-effective",Hair Removal
Dense - Anti-Hair Fall & Hair Growth Serum,Enriched with natural ingredients to combat hair fall and promote healthy hair growth.,"Natural ingredients, Non-greasy formula, Fast-absorbing","Strengthens hair roots, Promotes growth, Reduces hair fall",Hair Care
